{
  "formatVersion": 1,
  "name": "libgdx-screenmanager",
  "authors": [
    "damios"
  ],
  "description": "A screen manager for libgdx supporting transitions.",
  "projectUrl": "https://github.com/crykn/libgdx-screenmanager",
  "states": {
    "1.9.11": {
      "libraryVersion": "0.6.2",
      "coreDependencies": [
        "com.github.crykn:libgdx-screenmanager"
      ],
      "androidDependencies": [
        "org.xyz.android:whatever"
      ],
      "gwtDependencies": [
        "com.github.crykn:libgdx-screenmanager",
        "com.github.crykn:libgdx-screenmanager:sources",
        "com.github.crykn:libgdx-screenmanager-gwt",
        "com.github.crykn:libgdx-screenmanager-gwt:sources"
      ],
      "gwtInherits": [
        "libgdx_screenmanager",
        "libgdx_screenmanager_gwt"
      ],
      "androidPermissions": [
        "I_DONT_KNOW"
      ],
      "androidNativeDependencies": [
        "com.badlogicgames.gdx:gdx-box2d-platform:natives-armeabi",
        "com.badlogicgames.gdx:gdx-box2d-platform:natives-armeabi-v7a"
      ]
    },
    "1.9.10": {
      "libraryVersion": "0.5.1",
      "coreDependencies": [
        "com.github.crykn:libgdx-screenmanager"
      ],
      "gwtDependencies": [
        "com.github.crykn:libgdx-screenmanager",
        "com.github.crykn:libgdx-screenmanager:sources",
        "com.github.crykn:libgdx-screenmanager-gwt",
        "com.github.crykn:libgdx-screenmanager-gwt:sources"
      ],
      "gwtInherits": [
        "libgdx_screenmanager",
        "libgdx_screenmanager_gwt"
      ],
      "incompatiblePlatforms": [
        "android"
      ]
    }
  }
}